{
  "story_id": "CHRONODRIFT_EP10_VENICE",
  "episode_number": 10,
  "channel_brand": "CHRONODRIFT",
  "tagline": "Urban Time Travel & Future Cities (1626 ➔ 2026 ➔ 2226)",
  "city_key": "venice",
  "city_name": "Venecia",
  "total_duration_sec": 42.0,
  "target_engine": "gemini-omni-flash-preview",
  "keyframe_engine": "gemini-3.1-flash-image",
  "zero_veo_policy": true,
  "audio_spec": {
    "tempo_bpm": 118,
    "style": "Flow Chillhop / Urban Lo-Fi & Darksynth",
    "loudness_target_lufs": -14.0,
    "ducking_depth_db": -18.0,
    "true_peak_dbtp": -1.0
  },
  "hook_strategy": {
    "initial_hook_0_5s": "Inmersión bajo el agua del Gran Canal que emerge en el taller de un soplador de vidrio de Murano de 1626.",
    "target_first_minute_retention": ">90%",
    "target_avd": ">72%"
  },
  "canonical_shots": [
    {
      "shot_index": 1,
      "shot_id": "01_STRATOSPHERE_TIME_DIVE",
      "epoch": "TRANSITION_1626",
      "duration_sec": 4.5,
      "time_window": "0:00 - 0:04.5",
      "camera_motion": "Picado vertical a 140 km/h desde 850m AGL atravesando nubes volumétricas; al disiparse, el paisaje revela el trazado de Venecia en 1626.",
      "prompt_brief": "Epic high-speed vertical FPV dive through atmospheric volumetric clouds down into historic Venecia (Serenísima República) in the year 1626. Authentic period wooden structures, historic waterways, period ships, brick rooftops. Cinematic 35mm Kodak 500T, f/2.8, hyper-detailed photorealism.",
      "gemini_omni_flash_prompt": {
        "subject": "Historic cityscape of Venecia (Serenísima República) in the year 1626",
        "visual_specifics": "Authentic 1626 architecture, historical docks, timber and stone materials, volumetric mist",
        "action": "Vertical camera dive from stratosphere entering urban canopy at high speed and stabilizing at 35m AGL",
        "camera": "Continuous 6-DoF FPV dive, focal length 18mm, pitch -80deg to -15deg smooth transition",
        "lighting": "Golden morning sunlight breaking through parting volumetric cloud layers",
        "environment": "Historic topography of Venecia with authentic water bodies and natural vegetation",
        "audio": "Wind rushing Doppler dive effect transitioning into subtle distant period bells and water lap",
        "style": "Cinematic documentary, 60fps, 4K UHD, hyperrealistic photorealism, zero AI distortion"
      },
      "keyframe_prompts_7": [
        "KF1: High altitude 850m above Venecia looking straight down into cloud deck, sunlight edge",
        "KF2: Piercing through dense volumetric white clouds, motion blur on lens periphery",
        "KF3: Breaking out below clouds at 450m, initial outline of Serenísima República 1626 visible",
        "KF4: Mid-dive at 250m, distinguishing wooden rooftops, historic river courses and sailing vessels",
        "KF5: Low approach at 120m, architectural details of historic landmark buildings emerging",
        "KF6: Leveling out at 60m, detailed wooden beams, street cobblestones and period citizens visible",
        "KF7: Stable forward flight at 35m, banking right into the main historic thoroughfare"
      ],
      "hud_overlay": {
        "title": "SALTO TEMPORAL: VENECIA 1626",
        "telemetry": "ALT: 850m ➔ 35m | VEL: 140 km/h | FOV: 110° | EBU -14 LUFS",
        "fact_text": "En 1626 la urbe era el núcleo neurálgico de comercio y cultura de la región.",
        "citation": "Archivos Cartográficos Históricos & Overpass 3D Grounding"
      },
      "audio_cue": {
        "music_layer": "Intro beat Flow Chillhop / Darksynth (118 BPM) con filtrado suave",
        "foley": "Silbido de viento Doppler + campanas de bronce históricas",
        "ducking_db": -18.0
      }
    },
    {
      "shot_index": 2,
      "shot_id": "02_PAST_ALLEY_LOW_DRIFT",
      "epoch": "PAST_1626",
      "duration_sec": 6.0,
      "time_window": "0:04.5 - 0:10.5",
      "camera_motion": "Vuelo rasante a 1.8m del suelo deslizándose entre carruajes, mercados y arquitectura original de 1626.",
      "prompt_brief": "Low-altitude FPV drift at 1.8m above ground level in historic Venecia 1626. Palacio Ducal y Basílica de San Marcos en pleno apogeo naval, galeazas del Arsenal y talleres de Murano. Citizens in authentic period clothing, wooden stalls, warm amber morning sunlight, volumetric dust.",
      "gemini_omni_flash_prompt": {
        "subject": "Street-level daily life and architecture of Venecia in 1626",
        "visual_specifics": "Palacio Ducal y Basílica de San Marcos en pleno apogeo naval, galeazas del Arsenal y talleres de Murano, period textiles, wooden barrels, horse carriages, authentic materials",
        "action": "Smooth low-altitude FPV slalom between buildings, market stalls and historic facades",
        "camera": "Wide-angle 16mm lens, altitude 1.8m AGL, smooth roll +8deg / -8deg dynamic banking",
        "lighting": "Warm morning side-light casting long shadows on cobblestones and wooden planks",
        "environment": "Historic streetscape of Venecia with authentic 17th-century textures and atmospheric smoke",
        "audio": "Cobblestone clatter, distant merchant calls, creaking timber, flowing water",
        "style": "Authentic historical cinematic realism, 60fps, rich micro-contrast"
      },
      "keyframe_prompts_7": [
        "KF1: Entry into narrow historic lane of Venecia 1626, wooden facades framing the shot",
        "KF2: Passing close to authentic wooden market stall, handcrafted goods on display",
        "KF3: Citizens in authentic period attire turning towards the camera, morning light on faces",
        "KF4: Mid-lane bank around a wooden cart loaded with barrels and fabrics",
        "KF5: Low glide alongside historic stone wall and water canal with moored wooden boats",
        "KF6: Approaching historic stone bridge archway, water reflections dancing on the stone underside",
        "KF7: Centering precisely into the dark tunnel entrance of the historic bridge"
      ],
      "hud_overlay": {
        "title": "MORFOLOGÍA & VIDA URBANA 1626",
        "telemetry": "ALT: 1.8m AGL | HEADING: 090° | ROLL: +8° | 118 BPM FLOW",
        "fact_text": "Las técnicas constructivas combinaban madera local tratada y piedra sillar tallada a mano.",
        "citation": "Registro Arqueológico & Planos Históricos Originales"
      },
      "audio_cue": {
        "music_layer": "Bajo analógico cálido + percusión Lo-Fi fluida a 118 BPM",
        "foley": "Crujido de madera, cascos de caballos, murmullo de mercado",
        "ducking_db": -18.0
      }
    },
    {
      "shot_index": 3,
      "shot_id": "03_MATCH_CUT_PRESENT_PORTAL",
      "epoch": "TRANSITION_2026",
      "duration_sec": 5.5,
      "time_window": "0:10.5 - 0:16.0",
      "camera_motion": "El dron atraviesa un arco arquitectónico; en el centro exacto del umbral, la iluminación y los materiales mutan instantáneamente a 2026.",
      "prompt_brief": "Seamless match-cut transition shot. Drone enters a historic archway in 1626 and exits into contemporary Venecia 2026. Smooth spatial shift from historic materials to modern glass, steel, electric transit and contemporary pedestrians. 8K ultra-realistic clarity.",
      "gemini_omni_flash_prompt": {
        "subject": "Temporal portal match-cut from Venecia 1626 to modern Venecia 2026",
        "visual_specifics": "Left side of frame transitioning historical wood/stone to contemporary glass/steel, Gran Canal, Puente de Rialto, vaporettos eléctricos y barreras móviles MOSE activadas",
        "action": "Continuous uninterrupted camera vector through an archway, emerging into modern bustling city",
        "camera": "Locked axis dolly forward, perfectly matched horizon and vanishing point, FOV 100deg",
        "lighting": "Shift from warm 17th-century tungsten/torch amber to crisp daylight and LED reflections",
        "environment": "Urban transition from historic riverbank to modern metropolitan thoroughfare",
        "audio": "Low-pass filter opening up into full stereo spectrum, modern transit sounds and urban hum",
        "style": "Hyper-clean transition, zero temporal jitter, photorealistic 60fps"
      },
      "keyframe_prompts_7": [
        "KF1: Inside the historic archway in 1626, rough stone texture and warm lantern glow",
        "KF2: Advancing halfway through the arch, light at the end of tunnel begins shifting spectrum",
        "KF3: Center of portal, visual distortion wave as historic stone dissolves into brushed steel and glass",
        "KF4: Emerging from archway into bright 2026 sunlight, contemporary Venecia skyline instantly visible",
        "KF5: Passing modern electric transport and contemporary citizens with smartphones",
        "KF6: Accelerating down modern avenue, glass skyscrapers reflecting morning sky",
        "KF7: Banking upwards into the modern urban canyon of Venecia"
      ],
      "hud_overlay": {
        "title": "PRESENTE REAL: VENECIA 2026",
        "telemetry": "MATCH-CUT EXACTO: LAT/LON CONSTANTE | TELEMETRÍA 4K 60FPS",
        "fact_text": "Hoy la densidad y conectividad urbana multiplican por 50 la capacidad del núcleo histórico.",
        "citation": "Google Street View 360 Grounding & Cartografía 2026"
      },
      "audio_cue": {
        "music_layer": "Transición de filtro Low-Pass a estéreo Hi-Fi brillante con drop limpio",
        "foley": "Zumbido de motores eléctricos, timbres modernos y ambiente metropolitano",
        "ducking_db": -18.0
      }
    },
    {
      "shot_index": 4,
      "shot_id": "04_PRESENT_URBAN_CANYON_DRIFT",
      "epoch": "PRESENT_2026",
      "duration_sec": 6.5,
      "time_window": "0:16.0 - 0:22.5",
      "camera_motion": "Vuelo dinámico en espiral ascendente entre los cañones urbanos de Venecia 2026 mostrando la vibrante metrópolis.",